{
  "schema_version": "1.0",
  "project": {
    "episode": "EP01",
    "title": "『なんだろう』解体",
    "width": 1920,
    "height": 1080,
    "fps": 23.976,
    "fps_numerator": 24000,
    "fps_denominator": 1001,
    "duration_seconds": 585.0
  },
  "palette": {
    "ink": "#1A1A1A",
    "off_white": "#EAE6DF",
    "gold": "#C9A063",
    "vermilion": "#B8352E"
  },
  "cuts": [
    {
      "cut": "C01",
      "part": "P0",
      "tc_in": "00:00:00.000",
      "tc_out": "00:00:10.000",
      "in_seconds": 0.0,
      "out_seconds": 10.0,
      "in_frame": 0,
      "out_frame": 240,
      "duration_frames": 240,
      "category": "MGテンプレート",
      "template_id": "AE_CARD_STACK_THUMBNAIL",
      "visual": "黒背景に煽りサムネ(自作再現・3枚)が通知音と同時に次々スタック。1枚ごとに画面が埋まっていく",
      "automation": "3枚のサムネ画像を読み込み、通知音に合わせて順次スタック。各カードの出現遅延、105→100%スケール、最終微ズームを自動設定。",
      "required_inputs": "サムネ画像3枚、表示順、出現間隔、背景色、最終ズーム量",
      "support": "Canvaで架空サムネの静止画を一括作成。Claude/Codexは画像リストをAEへ流し込むJSX生成。VHSノイズはEnvato部品。",
      "manual_check": "サムネ文言の可読性と煽りの強さだけ確認。実在チャンネル・ロゴが混入していないことを確認。",
      "source_search": "—",
      "ai_prompt": "—",
      "effect_notes": "サムネにVHS風ノイズ薄く=「VHS overlay texture」",
      "transition_notes": "カット尻で全サムネ微ズーム寄り→C02へハードカット",
      "motion_notes": "1枚ごとにスケール105→100%のドン付き出現 [maxchar:10]",
      "params": {
        "fictional": true,
        "card_size": [
          1040,
          360
        ],
        "pop_frames": 8,
        "final_zoom": 104,
        "final_zoom_start": 180,
        "cards": [
          {
            "eyebrow": "速報",
            "headline": "日本、終わる",
            "accent": "#B8352E",
            "x": 0.37,
            "y": 0.34,
            "rotation": -3,
            "delay": 0
          },
          {
            "eyebrow": "知らないと危険",
            "headline": "年金、消える",
            "accent": "#C9A063",
            "x": 0.63,
            "y": 0.5,
            "rotation": 2,
            "delay": 18
          },
          {
            "eyebrow": "損する前に",
            "headline": "知らないと、損する",
            "accent": "#EAE6DF",
            "x": 0.49,
            "y": 0.67,
            "rotation": -1,
            "delay": 36
          }
        ]
      }
    },
    {
      "cut": "C02",
      "part": "P0",
      "tc_in": "00:00:10.000",
      "tc_out": "00:00:16.000",
      "in_seconds": 10.0,
      "out_seconds": 16.0,
      "in_frame": 240,
      "out_frame": 384,
      "duration_frames": 144,
      "category": "HTML/UI生成",
      "template_id": "UI_VIDEO_FEED_HOVER",
      "visual": "スクロールが止まり、カーソル(または親指)がサムネの上で一瞬ためらうUIモック",
      "automation": "架空動画フィードをHTML/CSSで描画し、スクロール停止、ホバー、カーソルのためらい、選択カード暗転をJSONから生成。",
      "required_inputs": "カード画像、タイトル、再生数、スクロール速度、停止対象、カーソル座標",
      "support": "Claude/CodexでHTML/CSS/JavaScriptを保守。C01のCanva製サムネをカード画像として再利用。",
      "manual_check": "実在YouTube UIの完全複製にせず、架空サービスとして法務・見た目を確認。",
      "source_search": "—",
      "ai_prompt": "—",
      "effect_notes": "画面全体を少し暗く(ビネット)=「vignette overlay」",
      "transition_notes": "ホバーした指/カーソル部分から白フラッシュ→C03",
      "motion_notes": "下部字幕フェードイン8F",
      "params": {}
    },
    {
      "cut": "C03",
      "part": "P0",
      "tc_in": "00:00:16.000",
      "tc_out": "00:00:22.000",
      "in_seconds": 16.0,
      "out_seconds": 22.0,
      "in_frame": 384,
      "out_frame": 527,
      "duration_frames": 143,
      "category": "MGテンプレート",
      "template_id": "AE_CARD_FOCUS_DROP",
      "visual": "この動画自身のサムネが画面中央に落ちてきて静止。周囲のサムネは暗く沈む",
      "automation": "C01のカード部品を再利用し、指定サムネを中央へ落下、周囲カードを暗転、静止後にモノクロ化。",
      "required_inputs": "主役サムネ画像、落下時間、周囲暗転率、モノクロ化時間",
      "support": "主役画像はCanvaまたは実際の本動画サムネ。微ダストのみEnvato。",
      "manual_check": "C01からC03までのカード位置が連続して見えるか確認。",
      "source_search": "—",
      "ai_prompt": "—",
      "effect_notes": "落下時に微ダスト=「dust particles overlay」",
      "transition_notes": "静止したサムネがモノクロ化しながらC04へディゾルブ",
      "motion_notes": "字幕フェードイン。「同じ手口」のみ字間+100に広げる",
      "params": {
        "fictional": true,
        "kicker": "THIS VIDEO",
        "headline": "同じ手口で作っています",
        "subline": "『なんだろう』解体 #01",
        "drop_frames": 18,
        "settle_frames": 8,
        "surrounding_opacity": 16,
        "monochrome_frame": 78
      }
    },
    {
      "cut": "C05",
      "part": "P0",
      "tc_in": "00:00:29.000",
      "tc_out": "00:00:34.000",
      "in_seconds": 29.0,
      "out_seconds": 34.0,
      "in_frame": 695,
      "out_frame": 815,
      "duration_frames": 120,
      "category": "HTML/UI生成",
      "template_id": "UI_ANALYTICS_DASHBOARD",
      "visual": "編集画面からYouTube Studio風のアナリティクス画面(自作モック)へ。数字がせわしなく動く",
      "automation": "架空分析ダッシュボード、折れ線、CTR、再生数、カード比較をHTML/SVGで生成し、数値変動を自動アニメーション。",
      "required_inputs": "指標名、開始値・終了値、グラフ点、サムネ画像、変動速度",
      "support": "Claude/CodexでUIコード生成。本人PC画面を使う場合は画面収録へ切替可能。",
      "manual_check": "YouTube Studioそのものに見えすぎないこと、個人情報・実数値が露出しないことを確認。",
      "source_search": "—",
      "ai_prompt": "—",
      "effect_notes": "モックにスクリーングロー=「screen glow overlay」",
      "transition_notes": "数字群が増殖して画面を埋め始め→C06",
      "motion_notes": "字幕フェードイン。「——」で0.5秒の間に合わせ字幕も2段階表示",
      "params": {}
    },
    {
      "cut": "C06",
      "part": "P0",
      "tc_in": "00:00:34.000",
      "tc_out": "00:00:47.000",
      "in_seconds": 34.0,
      "out_seconds": 47.0,
      "in_frame": 815,
      "out_frame": 1127,
      "duration_frames": 312,
      "category": "Envatoテンプレート",
      "template_id": "ENV_SCREEN_WALL_SWAP",
      "visual": "前半:ブラウン管TVの壁(古い質感)。後半:同じ構図でスマホ画面の壁に切り替わり、全部が煽り文言で明滅",
      "automation": "No PluginのTV／Screen Wallテンプレートを番組色へ改造し、各画面素材と切替タイミングだけ差し替える。",
      "required_inputs": "TV画面素材、スマホ画面素材、切替フレーム、点滅強度",
      "support": "Envatoのscreen wall／video wallを部品採用。Claude/Codexはプレースホルダー一括差替えJSXを作成。",
      "manual_check": "外部プラグイン不要か確認し、点滅が強すぎないよう調整。素材ライセンスを当該回へ登録。",
      "source_search": "wall of tv screens retro\nsmartphone screens grid glowing",
      "ai_prompt": "—",
      "effect_notes": "前半にCRT走査線=「CRT scanlines overlay」",
      "transition_notes": "TV壁→スマホ壁はホワイトアウトではなく\"信号切替\"風グリッチ1F=「glitch transition subtle」",
      "motion_notes": "★文:画面が一瞬暗転し中央に1文字ずつ2Fずらしでフェードイン。他の文はS1下部字幕 [pos:bottom]",
      "params": {}
    },
    {
      "cut": "C10",
      "part": "P0",
      "tc_in": "00:01:06.000",
      "tc_out": "00:01:12.000",
      "in_seconds": 66.0,
      "out_seconds": 72.0,
      "in_frame": 1582,
      "out_frame": 1726,
      "duration_frames": 144,
      "category": "MGテンプレート",
      "template_id": "AE_TITLE_EPISODE",
      "visual": "タイトルカード:墨背景に「ぜんぶ、売り物になっていく」+小さく『なんだろう』解体 #01",
      "automation": "話数、タイトル、副題を差し替え、字間収束、紙質感、フェード、次カットへの粒子化を番組プリセットで適用。",
      "required_inputs": "話数、タイトル、副題、保持秒数、アウト方式",
      "support": "番組用AEマスターのみ。紙テクスチャはEnvatoライブラリから固定素材を利用。",
      "manual_check": "長い題名の改行と保持時間のみ確認。",
      "source_search": "—",
      "ai_prompt": "—",
      "effect_notes": "紙テクスチャ背景=「paper texture background」",
      "transition_notes": "タイトルが粒子化して砕け、スマホスクロール実写へ=「particle dissolve transition」",
      "motion_notes": "タイトル:字間が広い状態から通常へ収束しつつフェードイン",
      "params": {
        "episode": "#01",
        "series": "『なんだろう』解体",
        "title": "ぜんぶ、売り物になっていく",
        "subtitle": "あなたの「つい」は、誰のお金になっているのか",
        "intro_frames": 18,
        "outro_frames": 18
      }
    },
    {
      "cut": "C12",
      "part": "P1",
      "tc_in": "00:01:22.000",
      "tc_out": "00:01:31.000",
      "in_seconds": 82.0,
      "out_seconds": 91.0,
      "in_frame": 1966,
      "out_frame": 2182,
      "duration_frames": 216,
      "category": "MG自動生成",
      "template_id": "DATA_BAR_WORD_GROWTH",
      "visual": "煽りワードがグラフの棒として伸びていく自作MG(ワード=棒のラベル)",
      "automation": "JSONの語句と値から棒グラフShape Layerを生成。棒の伸長、ラベル、数値カウント、順位変化を自動設定。",
      "required_inputs": "語句配列、各値、表示順、アクセント対象、最大値、尺",
      "support": "PythonでMG JSONを生成し、AE Shape Layer／Trim Pathsで描画。データ案の整理にClaudeを利用。",
      "manual_check": "値が事実データか演出値かを明記し、誤認を招かないか確認。",
      "source_search": "—",
      "ai_prompt": "—",
      "effect_notes": "数字・棒に微グロー=「glow effect overlay」",
      "transition_notes": "棒グラフが回転して→C13のカウンターへ",
      "motion_notes": "字幕フェード/グラフラベルはカウントアップ",
      "params": {
        "title": "不安ワードの『伸び』",
        "conceptual": true,
        "note": "概念図（値は演出用）",
        "draw_frames": 62,
        "stagger_frames": 12,
        "bars": [
          {
            "label": "経済が終わる",
            "value": 96,
            "accent": true
          },
          {
            "label": "年金が消える",
            "value": 84,
            "accent": false
          },
          {
            "label": "知らないと損",
            "value": 68,
            "accent": false
          }
        ]
      }
    },
    {
      "cut": "C13",
      "part": "P1",
      "tc_in": "00:01:31.000",
      "tc_out": "00:01:44.000",
      "in_seconds": 91.0,
      "out_seconds": 104.0,
      "in_frame": 2182,
      "out_frame": 2494,
      "duration_frames": 312,
      "category": "MG自動生成",
      "template_id": "DATA_FLOW_THREE_STEP",
      "visual": "再生回数カウンターが回る→数字が¥グラフへ変換されるフロー図の自作MG(視線→再生→広告費の3段変換)",
      "automation": "3段のノード、矢印、アイコン、数値をJSONから生成し、視線→再生→広告費を順番に開示。",
      "required_inputs": "ノード名3件、補足値、アイコンID、強調ノード、表示順",
      "support": "Claude/CodexでSVGアイコンとJSXを生成。共通アイコンは番組ライブラリへ保存。",
      "manual_check": "因果関係を断定しすぎない文言か確認。",
      "source_search": "—",
      "ai_prompt": "—",
      "effect_notes": "フロー矢印にライトスウィープ=「light sweep overlay」",
      "transition_notes": "¥グラフが編集タイムラインのUIへ変形→C14",
      "motion_notes": "★文:中央。「注意」のみ金茶+鍵括弧を1.2倍",
      "params": {
        "title": "注意がお金に変わるまで",
        "conceptual": true,
        "nodes": [
          {
            "icon": "◉",
            "label": "視線",
            "sub": "ATTENTION"
          },
          {
            "icon": "▶",
            "label": "再生",
            "sub": "VIEW"
          },
          {
            "icon": "¥",
            "label": "広告費",
            "sub": "REVENUE"
          }
        ],
        "reveal_frames": [
          8,
          38,
          68
        ],